{
  "schema_version": 1,
  "section": "monopoly",
  "section_title": "Монополия",
  "topic": "12-second-degree",
  "topic_title": "Дискриминация второго рода: скрининг",
  "knowledge": [
    {
      "id": "monopoly.second-degree.screening",
      "title": "Меню контрактов, участие и совместимость стимулов",
      "type": "mechanism",
      "definitions": {"участие": "Полезность выбранного контракта не ниже внешней альтернативы.", "совместимость стимулов": "Каждый тип предпочитает предназначенный ему контракт альтернативам меню."},
      "explanation": "При скрытом типе меню должно обеспечивать участие и самоотбор. Двухчастный тариф — фиксированная плата и цена единицы; прибыль меню сравнивают с альтернативными вариантами.",
      "source": {"id": "monopoly-analysis-docx", "name": "Полный аналитический конспект по монополии (DOCX)", "source_type": "docx", "excerpt": "Для меню проверяются участие и совместимость стимулов каждого типа."}
    }
  ]
}
