{
  "schema_version": 1,
  "section": "mathematical-base",
  "section_title": "Математическая база",
  "topic": "elasticity-mathematics",
  "topic_title": "Эластичность как математическое применение",
  "knowledge": [
    {
      "id": "mathematical-base.elasticity-mathematics.percentage-point-and-arc",
      "title": "Процентная, точечная и дуговая эластичность",
      "type": "term",
      "definitions": {},
      "explanation": "В контексте перечислены процентная, точечная и дуговая эластичность.",
      "source": {
        "id": "context.elasticity-mathematics",
        "name": "Исследовательский контекст, присланный пользователем (на основе Учебника Рэма Бахарева и Памятки для олимпиадников)",
        "source_type": "text",
        "excerpt": "Процентная эластичность; точечная; дуговая; эластичность через производную; постоянная эластичность; обратная эластичность; эластичность выручки; эластичность по доходу. Эластичность: E = ΔQ%/ΔP%. E = Q'P/Q."
      }
    },
    {
      "id": "mathematical-base.elasticity-mathematics.formulas",
      "title": "Формулы эластичности",
      "type": "formula",
      "formula": "E = ΔQ%/ΔP%; E = Q'P/Q",
      "definitions": {},
      "explanation": "В контексте приведены запись эластичности через процентные изменения и запись через производную.",
      "source": {
        "id": "context.elasticity-mathematics",
        "name": "Исследовательский контекст, присланный пользователем (на основе Учебника Рэма Бахарева и Памятки для олимпиадников)",
        "source_type": "text",
        "excerpt": "Процентная эластичность; точечная; дуговая; эластичность через производную; постоянная эластичность; обратная эластичность; эластичность выручки; эластичность по доходу. Эластичность: E = ΔQ%/ΔP%. E = Q'P/Q."
      }
    },
    {
      "id": "mathematical-base.elasticity-mathematics.constant-inverse-revenue-income",
      "title": "Постоянная, обратная, по выручке и по доходу",
      "type": "term",
      "definitions": {},
      "explanation": "В контексте перечислены постоянная и обратная эластичность, эластичность выручки и эластичность по доходу.",
      "source": {
        "id": "context.elasticity-mathematics",
        "name": "Исследовательский контекст, присланный пользователем (на основе Учебника Рэма Бахарева и Памятки для олимпиадников)",
        "source_type": "text",
        "excerpt": "Процентная эластичность; точечная; дуговая; эластичность через производную; постоянная эластичность; обратная эластичность; эластичность выручки; эластичность по доходу. Эластичность: E = ΔQ%/ΔP%. E = Q'P/Q."
      }
    }
  ]
}
