{
  "schema_version": 1,
  "section": "monopoly",
  "section_title": "Монополия",
  "topic": "04-elasticity-lerner",
  "topic_title": "Эластичность и индекс Лернера",
  "knowledge": [
    {
      "id": "monopoly.elasticity.lerner-index",
      "title": "Индекс Лернера и эластичность спроса",
      "type": "formula",
      "formula": "(P−MC)/P=−1/ε; ε=(dQ/dP)(P/Q)<0",
      "definitions": {"ε": "Ценовая эластичность спроса в принятом отрицательном обозначении"},
      "explanation": "Связь применяется для классического гладкого внутреннего оптимума единого ценника. При P=50 и ε=−3 индекс равен 1/3, откуда MC=100/3. Проверяйте предпосылки, особенно при ограничениях или нетипичных предельных затратах.",
      "source": {"id": "monopoly-analysis-docx", "name": "Полный аналитический конспект по монополии (DOCX)", "source_type": "docx", "excerpt": "При P=50, ε=−3: индекс 1/3, поэтому MC=100/3."}
    }
  ]
}
