{
  "schema_version": 1,
  "section": "mathematical-base",
  "section_title": "Математическая база",
  "topic": "equations-and-inequalities",
  "topic_title": "Уравнения и неравенства",
  "knowledge": [
    {
      "id": "mathematical-base.equations-and-inequalities.verbal-condition-to-equation",
      "title": "Составление уравнения из словесного условия",
      "type": "mechanism",
      "definitions": {},
      "explanation": "Составление уравнения из словесного условия прямо указано в контексте.",
      "source": {
        "id": "context.equations-and-inequalities",
        "name": "Исследовательский контекст, присланный пользователем (на основе Учебника Рэма Бахарева и Памятки для олимпиадников)",
        "source_type": "text",
        "excerpt": "Составление уравнения из словесного условия; решение уравнений; неравенства; допустимые интервалы; ограничения."
      }
    },
    {
      "id": "mathematical-base.equations-and-inequalities.equations-and-inequalities",
      "title": "Решение уравнений и неравенства",
      "type": "mechanism",
      "definitions": {},
      "explanation": "В контексте вместе перечислены решение уравнений и неравенства.",
      "source": {
        "id": "context.equations-and-inequalities",
        "name": "Исследовательский контекст, присланный пользователем (на основе Учебника Рэма Бахарева и Памятки для олимпиадников)",
        "source_type": "text",
        "excerpt": "Составление уравнения из словесного условия; решение уравнений; неравенства; допустимые интервалы; ограничения."
      }
    },
    {
      "id": "mathematical-base.equations-and-inequalities.allowed-intervals-and-constraints",
      "title": "Допустимые интервалы и ограничения",
      "type": "mechanism",
      "definitions": {},
      "explanation": "Допустимые интервалы и ограничения перечислены как части работы с уравнениями и неравенствами.",
      "source": {
        "id": "context.equations-and-inequalities",
        "name": "Исследовательский контекст, присланный пользователем (на основе Учебника Рэма Бахарева и Памятки для олимпиадников)",
        "source_type": "text",
        "excerpt": "Составление уравнения из словесного условия; решение уравнений; неравенства; допустимые интервалы; ограничения."
      }
    }
  ]
}
