{"schema_version":1,"section":"costs-and-firm","section_title":"Издержки и фирма","topic":"production","topic_title":"Производство","knowledge":[
{"id":"costs-and-firm.production.factors-and-production-function","title":"Факторы производства и производственная функция","type":"formula","formula":"Q=f(K,L)","definitions":{},"explanation":"В отчёте перечислены труд L, капитал K, сырьё и производственная функция Q=f(K,L).","source":{"id":"context.costs-and-firm.production","name":"Исследовательский контекст, присланный пользователем","source_type":"text","excerpt":"Производство: факторы производства; труд L; капитал K; сырьё; производственная функция Q=f(K,L); построение производственной функции из технологических ограничений; TP; AP/APL; MP/MPL/MPK; производительность; связь APL и AVC; отдача от масштаба; различие отдачи от масштаба и эффекта масштаба."}},
{"id":"costs-and-firm.production.technology-to-function","title":"Построение производственной функции","type":"mechanism","definitions":{},"explanation":"Отчёт указывает построение производственной функции из технологических ограничений.","source":{"id":"context.costs-and-firm.production","name":"Исследовательский контекст, присланный пользователем","source_type":"text","excerpt":"Производство: факторы производства; труд L; капитал K; сырьё; производственная функция Q=f(K,L); построение производственной функции из технологических ограничений; TP; AP/APL; MP/MPL/MPK; производительность; связь APL и AVC; отдача от масштаба; различие отдачи от масштаба и эффекта масштаба."}},
{"id":"costs-and-firm.production.total-average-and-marginal-product","title":"TP, AP/APL и MP/MPL/MPK","type":"term","definitions":{},"explanation":"TP, AP/APL и MP/MPL/MPK перечислены в отчёте как элементы производственного аппарата.","source":{"id":"context.costs-and-firm.production","name":"Исследовательский контекст, присланный пользователем","source_type":"text","excerpt":"Производство: факторы производства; труд L; капитал K; сырьё; производственная функция Q=f(K,L); построение производственной функции из технологических ограничений; TP; AP/APL; MP/MPL/MPK; производительность; связь APL и AVC; отдача от масштаба; различие отдачи от масштаба и эффекта масштаба."}},
{"id":"costs-and-firm.production.productivity-and-avc","title":"Производительность, APL и AVC","type":"causal_relationship","definitions":{},"explanation":"Отчёт отдельно включает производительность и связь APL и AVC.","source":{"id":"context.costs-and-firm.production","name":"Исследовательский контекст, присланный пользователем","source_type":"text","excerpt":"Производство: факторы производства; труд L; капитал K; сырьё; производственная функция Q=f(K,L); построение производственной функции из технологических ограничений; TP; AP/APL; MP/MPL/MPK; производительность; связь APL и AVC; отдача от масштаба; различие отдачи от масштаба и эффекта масштаба."}},
{"id":"costs-and-firm.production.returns-versus-scale-effect","title":"Отдача от масштаба и эффект масштаба","type":"comparison","definitions":{},"explanation":"В отчёте требуется различать отдачу от масштаба и эффект масштаба.","source":{"id":"context.costs-and-firm.production","name":"Исследовательский контекст, присланный пользователем","source_type":"text","excerpt":"Производство: факторы производства; труд L; капитал K; сырьё; производственная функция Q=f(K,L); построение производственной функции из технологических ограничений; TP; AP/APL; MP/MPL/MPK; производительность; связь APL и AVC; отдача от масштаба; различие отдачи от масштаба и эффекта масштаба."}}]}
