{
  "schema_version": 1,
  "section": "mathematical-base",
  "section_title": "Математическая база",
  "topic": "olympiad-constructions",
  "topic_title": "Конструкции олимпиадных задач",
  "knowledge": [
    {"id":"mathematical-base.olympiad-constructions.parabola-on-segment","title":"Парабола на отрезке","type":"mechanism","definitions":{},"explanation":"Найти вершину, проверить её принадлежность отрезку; иначе сравнить значения на концах. Для −x²+ax+5 на [0,10] оптимум меняется между левым концом, вершиной и правым концом в зависимости от a.","source":{"id":"context.math-construction-01","name":"Каталог конструкций олимпиадных задач из пользовательского конспекта","source_type":"markdown","excerpt":"Найти вершину, проверить принадлежность отрезку; иначе сравнить концы. Для `-x²+ax+5` на `[0,10]` оптимум меняется между левым концом, вершиной и правым концом в зависимости от `a`."}},
    {"id":"mathematical-base.olympiad-constructions.parameter-in-vertex","title":"Параметр в вершине","type":"mechanism","definitions":{},"explanation":"Сравнить положение вершины с движущимися границами; переходы происходят, когда вершина достигает границы.","source":{"id":"context.math-construction-02","name":"Каталог конструкций олимпиадных задач из пользовательского конспекта","source_type":"markdown","excerpt":"Сравнить положение вершины с движущимися границами; переходы происходят, когда вершина достигает границы."}},
    {"id":"mathematical-base.olympiad-constructions.product-of-multipliers","title":"Произведение множителей цены и количества","type":"mechanism","definitions":{},"explanation":"Переписать прибыль в виде квадратичной функции, проверить внутреннюю вершину и допустимые границы.","source":{"id":"context.math-construction-03","name":"Каталог конструкций олимпиадных задач из пользовательского конспекта","source_type":"markdown","excerpt":"Переписать прибыль в виде квадратичной функции, проверить внутреннюю вершину и допустимые границы."}},
    {"id":"mathematical-base.olympiad-constructions.piecewise-profit","title":"Кусочная прибыль","type":"mechanism","definitions":{},"explanation":"Оптимизировать каждую формулу на её собственном участке, проверить точки стыка и сравнить значения.","source":{"id":"context.math-construction-04","name":"Каталог конструкций олимпиадных задач из пользовательского конспекта","source_type":"markdown","excerpt":"Оптимизировать каждую формулу на её собственном участке, проверить точки стыка и сравнить значения."}},
    {"id":"mathematical-base.olympiad-constructions.stationary-without-extremum","title":"Стационарная точка без экстремума","type":"mechanism","definitions":{},"explanation":"Таблица знаков производной отличает корни чётной кратности и точки перегиба от максимумов и минимумов.","source":{"id":"context.math-construction-05","name":"Каталог конструкций олимпиадных задач из пользовательского конспекта","source_type":"markdown","excerpt":"Таблица знаков производной отличает корни чётной кратности и точки перегиба от максимумов и минимумов."}},
    {"id":"mathematical-base.olympiad-constructions.resource-constraint","title":"Ограничение ресурса","type":"mechanism","definitions":{},"explanation":"Решать задачу на допустимом множестве; равенство бюджета допустимо использовать только после обоснования активного ограничения.","source":{"id":"context.math-construction-06","name":"Каталог конструкций олимпиадных задач из пользовательского конспекта","source_type":"markdown","excerpt":"Решать задачу на допустимом множестве; равенство бюджета допустимо использовать только после обоснования активного ограничения."}},
    {"id":"mathematical-base.olympiad-constructions.linear-objective-polygon","title":"Линейная цель на многоугольнике","type":"mechanism","definitions":{},"explanation":"Сравнить вершины; при параллельности целевой прямой стороне возможен целый отрезок оптимумов.","source":{"id":"context.math-construction-07","name":"Каталог конструкций олимпиадных задач из пользовательского конспекта","source_type":"markdown","excerpt":"Сравнить вершины; при параллельности целевой прямой стороне возможен целый отрезок оптимумов."}},
    {"id":"mathematical-base.olympiad-constructions.multiple-goods-min-max","title":"Несколько товаров с min/max","type":"mechanism","definitions":{},"explanation":"Разбить задачу по областям, где активны разные ветви min/max, и проверить границу переключения.","source":{"id":"context.math-construction-08","name":"Каталог конструкций олимпиадных задач из пользовательского конспекта","source_type":"markdown","excerpt":"Разбить задачу по областям, где активны разные ветви `min`/`max`, и проверить границу переключения."}},
    {"id":"mathematical-base.olympiad-constructions.integer-choice","title":"Целочисленное решение","type":"mechanism","definitions":{},"explanation":"Перечислить допустимые целые значения; для каждого оптимизировать остальные переменные, затем сравнить.","source":{"id":"context.math-construction-09","name":"Каталог конструкций олимпиадных задач из пользовательского конспекта","source_type":"markdown","excerpt":"Перечислить допустимые целые значения; для каждого оптимизировать остальные переменные, затем сравнить."}},
    {"id":"mathematical-base.olympiad-constructions.bounded-capacity","title":"Ограниченная производственная мощность","type":"mechanism","definitions":{},"explanation":"Кандидаты: стационарные точки, концы отрезка и точки, где производная не существует; сравниваются значения исходной функции.","source":{"id":"context.math-construction-10","name":"Каталог конструкций олимпиадных задач из пользовательского конспекта","source_type":"markdown","excerpt":"Кандидаты: стационарные точки, концы отрезка и точки, где производная не существует; сравниваются значения исходной функции."}},
    {"id":"mathematical-base.olympiad-constructions.continuous-discrete-marginal","title":"Предельное изменение: непрерывное и дискретное","type":"mechanism","definitions":{},"explanation":"Сопоставить производную с точной разностью f(n)−f(n−1) и не подменять одну другой.","source":{"id":"context.math-construction-11","name":"Каталог конструкций олимпиадных задач из пользовательского конспекта","source_type":"markdown","excerpt":"Сопоставить производную с точной разностью `f(n)-f(n-1)` и не подменять одну другой."}},
    {"id":"mathematical-base.olympiad-constructions.multiple-production-sites","title":"Несколько производственных площадок","type":"mechanism","definitions":{},"explanation":"Распределять выпуск через сравнение предельных издержек; при отсутствии выпуска на площадке отдельно проверить условие её включения.","source":{"id":"context.math-construction-12","name":"Каталог конструкций олимпиадных задач из пользовательского конспекта","source_type":"markdown","excerpt":"Распределять выпуск через сравнение предельных издержек; при отсутствии выпуска на площадке отдельно проверить условие её включения."}},
    {"id":"mathematical-base.olympiad-constructions.average-cost","title":"Средние издержки","type":"mechanism","definitions":{},"explanation":"Использовать связь AC'=(MC−AC)/Q только при Q>0; равенство MC=AC относится к внутреннему минимуму AC.","source":{"id":"context.math-construction-13","name":"Каталог конструкций олимпиадных задач из пользовательского конспекта","source_type":"markdown","excerpt":"Использовать связь `AC'=(MC-AC)/Q` только при `Q>0`; равенство `MC=AC` относится к внутреннему минимуму AC."}},
    {"id":"mathematical-base.olympiad-constructions.decision-before-after-information","title":"Решение до и после получения информации","type":"mechanism","definitions":{},"explanation":"До информации выбрать одно действие для всех состояний; после информации действие может зависеть от наблюдённого состояния. Сравнить ожидаемые результаты.","source":{"id":"context.math-construction-14","name":"Каталог конструкций олимпиадных задач из пользовательского конспекта","source_type":"markdown","excerpt":"До информации выбрать одно действие для всех состояний; после информации действие может зависеть от наблюдённого состояния. Сравнить ожидаемые результаты."}}
  ]
}
