{
  "schema_version": 1,
  "section": "mathematical-base",
  "section_title": "Математическая база",
  "topic": "growth-rates-and-indices",
  "topic_title": "Темпы роста и индексы",
  "knowledge": [
    {
      "id": "mathematical-base.growth-rates-and-indices.growth-and-change-rates",
      "title": "Темп роста и темп изменения",
      "type": "term",
      "definitions": {},
      "explanation": "Темп роста и темп изменения перечислены в контексте.",
      "source": {
        "id": "context.growth-rates-and-indices",
        "name": "Исследовательский контекст, присланный пользователем (на основе Учебника Рэма Бахарева и Памятки для олимпиадников)",
        "source_type": "text",
        "excerpt": "Темп роста; темп изменения; номинальные/реальные величины в тех местах, где математическая конструкция относится к базе; индексы, которые реально указаны в присланном контексте."
      }
    },
    {
      "id": "mathematical-base.growth-rates-and-indices.nominal-real-and-indices",
      "title": "Номинальные и реальные величины, индексы",
      "type": "term",
      "definitions": {},
      "explanation": "В контексте указаны номинальные и реальные величины там, где математическая конструкция относится к базе, и индексы, реально указанные в контексте.",
      "source": {
        "id": "context.growth-rates-and-indices",
        "name": "Исследовательский контекст, присланный пользователем (на основе Учебника Рэма Бахарева и Памятки для олимпиадников)",
        "source_type": "text",
        "excerpt": "Темп роста; темп изменения; номинальные/реальные величины в тех местах, где математическая конструкция относится к базе; индексы, которые реально указаны в присланном контексте."
      }
    }
  ]
}
