{
  "schema_version": 1,
  "section": "mathematical-base",
  "section_title": "Математическая база",
  "topic": "optimization",
  "topic_title": "Оптимизация",
  "knowledge": [
    {
      "id": "mathematical-base.optimization.extrema-and-critical-point",
      "title": "Экстремум и критическая точка",
      "type": "formula",
      "formula": "f'(x)=0",
      "definitions": {},
      "explanation": "В контексте перечислены экстремум, локальный и глобальный экстремум, критическая точка и поиск экстремума через производную; указано условие критической точки.",
      "source": {
        "id": "context.optimization",
        "name": "Исследовательский контекст, присланный пользователем (на основе Учебника Рэма Бахарева и Памятки для олимпиадников)",
        "source_type": "text",
        "excerpt": "Экстремум; локальный/глобальный экстремум; критическая точка; поиск экстремума через производную; оптимизация с ограничениями; оптимизация на границе; оптимизация кусочной функции; оптимизация с параметром; многомерная оптимизация. Условие критической точки: f'(x)=0. Кусочная функция → оптимизация каждого участка → сравнение. Несколько переменных → последовательная оптимизация."
      }
    },
    {
      "id": "mathematical-base.optimization.constraints-and-boundary",
      "title": "Оптимизация с ограничениями и на границе",
      "type": "mechanism",
      "definitions": {},
      "explanation": "Оптимизация с ограничениями и оптимизация на границе перечислены в контексте.",
      "source": {
        "id": "context.optimization",
        "name": "Исследовательский контекст, присланный пользователем (на основе Учебника Рэма Бахарева и Памятки для олимпиадников)",
        "source_type": "text",
        "excerpt": "Экстремум; локальный/глобальный экстремум; критическая точка; поиск экстремума через производную; оптимизация с ограничениями; оптимизация на границе; оптимизация кусочной функции; оптимизация с параметром; многомерная оптимизация. Условие критической точки: f'(x)=0. Кусочная функция → оптимизация каждого участка → сравнение. Несколько переменных → последовательная оптимизация."
      }
    },
    {
      "id": "mathematical-base.optimization.piecewise-and-parameter",
      "title": "Оптимизация кусочной функции и с параметром",
      "type": "mechanism",
      "definitions": {},
      "explanation": "В контексте перечислены оптимизация кусочной функции и оптимизация с параметром; отдельно указана связка «кусочная функция → оптимизация каждого участка → сравнение».",
      "source": {
        "id": "context.optimization",
        "name": "Исследовательский контекст, присланный пользователем (на основе Учебника Рэма Бахарева и Памятки для олимпиадников)",
        "source_type": "text",
        "excerpt": "Экстремум; локальный/глобальный экстремум; критическая точка; поиск экстремума через производную; оптимизация с ограничениями; оптимизация на границе; оптимизация кусочной функции; оптимизация с параметром; многомерная оптимизация. Условие критической точки: f'(x)=0. Кусочная функция → оптимизация каждого участка → сравнение. Несколько переменных → последовательная оптимизация."
      }
    },
    {
      "id": "mathematical-base.optimization.multivariable-sequential",
      "title": "Многомерная и последовательная оптимизация",
      "type": "mechanism",
      "definitions": {},
      "explanation": "Многомерная оптимизация указана в контексте; также приведена связка «несколько переменных → последовательная оптимизация».",
      "source": {
        "id": "context.optimization",
        "name": "Исследовательский контекст, присланный пользователем (на основе Учебника Рэма Бахарева и Памятки для олимпиадников)",
        "source_type": "text",
        "excerpt": "Экстремум; локальный/глобальный экстремум; критическая точка; поиск экстремума через производную; оптимизация с ограничениями; оптимизация на границе; оптимизация кусочной функции; оптимизация с параметром; многомерная оптимизация. Условие критической точки: f'(x)=0. Кусочная функция → оптимизация каждого участка → сравнение. Несколько переменных → последовательная оптимизация."
      }
    }
  ]
}
