{"schema_version":1,"section":"costs-and-firm","section_title":"Издержки и фирма","topic":"supply-function","topic_title":"Функция предложения","knowledge":[
{"id":"costs-and-firm.supply-function.cost-to-supply-chain","title":"Цепочка от TC к функции предложения","type":"mechanism","formula":"Qs=Q*(P)","definitions":{},"explanation":"Отчёт задаёт цепочку TC → MC → оптимальный выпуск и функцию предложения Qs=Q*(P).","source":{"id":"context.costs-and-firm.supply-function","name":"Исследовательский контекст, присланный пользователем","source_type":"text","excerpt":"Функция предложения: Qs=Q*(P); TC → MC → оптимальный выпуск; MC → функция предложения; условия применимости; непрерывная TC; разрывная TC; скачок фиксированных затрат; проверка точек разрыва."}},
{"id":"costs-and-firm.supply-function.continuous-cost-and-applicability","title":"Непрерывная TC и условия применимости","type":"mechanism","definitions":{},"explanation":"Условия применимости и непрерывная TC перечислены в отчёте для построения функции предложения.","source":{"id":"context.costs-and-firm.supply-function","name":"Исследовательский контекст, присланный пользователем","source_type":"text","excerpt":"Функция предложения: Qs=Q*(P); TC → MC → оптимальный выпуск; MC → функция предложения; условия применимости; непрерывная TC; разрывная TC; скачок фиксированных затрат; проверка точек разрыва."}},
{"id":"costs-and-firm.supply-function.discontinuities-and-fixed-cost-jump","title":"Разрывная TC и скачок фиксированных затрат","type":"mechanism","definitions":{},"explanation":"Отчёт включает разрывную TC, скачок фиксированных затрат и проверку точек разрыва.","source":{"id":"context.costs-and-firm.supply-function","name":"Исследовательский контекст, присланный пользователем","source_type":"text","excerpt":"Функция предложения: Qs=Q*(P); TC → MC → оптимальный выпуск; MC → функция предложения; условия применимости; непрерывная TC; разрывная TC; скачок фиксированных затрат; проверка точек разрыва."}}]}
