{
  "schema_version": 1,
  "section": "monopoly",
  "section_title": "Монополия",
  "topic": "08-price-ceiling",
  "topic_title": "Потолок цены",
  "knowledge": [
    {
      "id": "monopoly.ceiling.piecewise-response",
      "title": "Кусочная реакция на потолок цены",
      "type": "mechanism",
      "formula": "на ограниченном участке MR=P̄; после точки соединения действует исходный MR",
      "definitions": {},
      "explanation": "Проверяют свободный оптимум, участки потолка, точку соединения, граничные выпуски и закрытие производства. В задаче 24 порог между режимами возникает из сравнения полных прибылей при скачке MC.",
      "source": {"id": "monopoly-analysis-docx", "name": "Полный аналитический конспект по монополии (DOCX)", "source_type": "docx", "excerpt": "При скачке затрат порог возникает из сравнения прибыли кандидатов на разных ветвях."}
    }
  ]
}
