{
  "schema_version": 1,
  "section": "monopoly",
  "section_title": "Монополия",
  "topic": "15-labor-monopsony",
  "topic_title": "Монопсония труда и минимальная зарплата",
  "knowledge": [
    {
      "id": "monopoly.labor.mrp-and-minimum-wage",
      "title": "Предельный доходный продукт труда и кусочная занятость",
      "type": "common_mistake",
      "formula": "MRP_L=1000−32L; без минимума L*=1000/33, w*=500/33",
      "definitions": {},
      "explanation": "В задаче 22 буквальная постановка даёт собственную кусочную функцию занятости при минимальной зарплате; функция ключа с L=40 в низком режиме и знаменателем 24 в следующем режиме ей не соответствует. Сохранять расчёт и оговорку о трактовке регулирования.",
      "source": {"id": "monopoly-analysis-docx", "name": "Полный аналитический конспект по монополии (DOCX)", "source_type": "docx", "excerpt": "Ключ задачника не согласуется с буквальным выводом из условия."}
    }
  ]
}
