{
  "schema_version": 1,
  "section": "monopoly",
  "section_title": "Монополия",
  "topic": "09-discrimination-overview",
  "topic_title": "Ценовая дискриминация: условия и типы",
  "knowledge": [
    {
      "id": "monopoly.discrimination.types-and-conditions",
      "title": "Условия и три рода ценовой дискриминации",
      "type": "definition",
      "definitions": {"ценовая дискриминация": "Продажа одинакового товара разным покупателям по различным ценам."},
      "explanation": "Нужны рыночная власть, сегментация покупателей и невозможность или ограничение перепродажи. Первый род использует индивидуальную готовность платить, второй — меню и самоотбор, третий — разные цены наблюдаемым сегментам.",
      "source": {"id": "monopoly-analysis-docx", "name": "Полный аналитический конспект по монополии (DOCX)", "source_type": "docx", "excerpt": "Для дискриминации нужны рыночная власть, сегментация покупателей и ограничение перепродажи."}
    }
  ]
}
