{
  "schema_version": 1,
  "section": "mathematical-base",
  "section_title": "Математическая база",
  "topic": "derivatives",
  "topic_title": "Производные",
  "knowledge": [
    {
      "id": "mathematical-base.derivatives.definition-and-growth-rate",
      "title": "Определение и смысл производной",
      "type": "formula",
      "formula": "f'(x) = lim(Δx→0) [f(x+Δx)-f(x)]/Δx",
      "definitions": {},
      "explanation": "В контексте перечислены смысл производной, скорость роста, определение и геометрический смысл; формула определения сохранена без изменений.",
      "source": {
        "id": "context.derivatives",
        "name": "Исследовательский контекст, присланный пользователем (на основе Учебника Рэма Бахарева и Памятки для олимпиадников)",
        "source_type": "text",
        "excerpt": "Смысл производной; скорость роста; определение; геометрический смысл; касательная; производная степени; константы; суммы; произведения; частного; сложной функции; вторая производная; дискретная производная. f'(x) = lim(Δx→0) [f(x+Δx)-f(x)]/Δx. (ax^n)' = anx^(n-1). (f+g)' = f'+g'. (fg)' = f'g + g'f. (f/g)' = (f'g-g'f)/g². (f(g(x)))' = f'(g(x))g'(x). f'_d = f(x)-f(x-1). Функция → производная → предельное изменение."
      }
    },
    {
      "id": "mathematical-base.derivatives.elementary-rules",
      "title": "Производная степени, константы и суммы",
      "type": "formula",
      "formula": "(ax^n)' = anx^(n-1); (f+g)' = f'+g'",
      "definitions": {},
      "explanation": "В контексте перечислены производная степени, константы и суммы; для степени и суммы приведены формулы.",
      "source": {
        "id": "context.derivatives",
        "name": "Исследовательский контекст, присланный пользователем (на основе Учебника Рэма Бахарева и Памятки для олимпиадников)",
        "source_type": "text",
        "excerpt": "Смысл производной; скорость роста; определение; геометрический смысл; касательная; производная степени; константы; суммы; произведения; частного; сложной функции; вторая производная; дискретная производная. f'(x) = lim(Δx→0) [f(x+Δx)-f(x)]/Δx. (ax^n)' = anx^(n-1). (f+g)' = f'+g'. (fg)' = f'g + g'f. (f/g)' = (f'g-g'f)/g². (f(g(x)))' = f'(g(x))g'(x). f'_d = f(x)-f(x-1). Функция → производная → предельное изменение."
      }
    },
    {
      "id": "mathematical-base.derivatives.product-quotient-and-composite",
      "title": "Производная произведения, частного и сложной функции",
      "type": "formula",
      "formula": "(fg)' = f'g + g'f; (f/g)' = (f'g-g'f)/g²; (f(g(x)))' = f'(g(x))g'(x)",
      "definitions": {},
      "explanation": "В контексте приведены формулы производной произведения, частного и сложной функции.",
      "source": {
        "id": "context.derivatives",
        "name": "Исследовательский контекст, присланный пользователем (на основе Учебника Рэма Бахарева и Памятки для олимпиадников)",
        "source_type": "text",
        "excerpt": "Смысл производной; скорость роста; определение; геометрический смысл; касательная; производная степени; константы; суммы; произведения; частного; сложной функции; вторая производная; дискретная производная. f'(x) = lim(Δx→0) [f(x+Δx)-f(x)]/Δx. (ax^n)' = anx^(n-1). (f+g)' = f'+g'. (fg)' = f'g + g'f. (f/g)' = (f'g-g'f)/g². (f(g(x)))' = f'(g(x))g'(x). f'_d = f(x)-f(x-1). Функция → производная → предельное изменение."
      }
    },
    {
      "id": "mathematical-base.derivatives.second-and-discrete-derivatives",
      "title": "Вторая и дискретная производные",
      "type": "formula",
      "formula": "f'_d = f(x)-f(x-1)",
      "definitions": {},
      "explanation": "Вторая и дискретная производные перечислены в контексте; для дискретной приведена формула.",
      "source": {
        "id": "context.derivatives",
        "name": "Исследовательский контекст, присланный пользователем (на основе Учебника Рэма Бахарева и Памятки для олимпиадников)",
        "source_type": "text",
        "excerpt": "Смысл производной; скорость роста; определение; геометрический смысл; касательная; производная степени; константы; суммы; произведения; частного; сложной функции; вторая производная; дискретная производная. f'(x) = lim(Δx→0) [f(x+Δx)-f(x)]/Δx. (ax^n)' = anx^(n-1). (f+g)' = f'+g'. (fg)' = f'g + g'f. (f/g)' = (f'g-g'f)/g². (f(g(x)))' = f'(g(x))g'(x). f'_d = f(x)-f(x-1). Функция → производная → предельное изменение."
      }
    },
    {
      "id": "mathematical-base.derivatives.function-derivative-marginal-change",
      "title": "Связка «функция — производная — предельное изменение»",
      "type": "causal_relationship",
      "definitions": {},
      "explanation": "В контексте указана последовательность «функция → производная → предельное изменение».",
      "source": {
        "id": "context.derivatives",
        "name": "Исследовательский контекст, присланный пользователем (на основе Учебника Рэма Бахарева и Памятки для олимпиадников)",
        "source_type": "text",
        "excerpt": "Смысл производной; скорость роста; определение; геометрический смысл; касательная; производная степени; константы; суммы; произведения; частного; сложной функции; вторая производная; дискретная производная. f'(x) = lim(Δx→0) [f(x+Δx)-f(x)]/Δx. (ax^n)' = anx^(n-1). (f+g)' = f'+g'. (fg)' = f'g + g'f. (f/g)' = (f'g-g'f)/g². (f(g(x)))' = f'(g(x))g'(x). f'_d = f(x)-f(x-1). Функция → производная → предельное изменение."
      }
    }
  ]
}
