{
  "schema_version": 1,
  "section": "mathematical-base",
  "section_title": "Математическая база",
  "topic": "functions-and-graphs",
  "topic_title": "Функции и графики",
  "knowledge": [
    {
      "id": "mathematical-base.functions-and-graphs.function-graph-range",
      "title": "Функция, график и заданный диапазон",
      "type": "graphical_concept",
      "definitions": {},
      "explanation": "В контексте перечислены функция, графическое представление и работа функции на заданном диапазоне.",
      "source": {
        "id": "context.functions-and-graphs",
        "name": "Исследовательский контекст, присланный пользователем (на основе Учебника Рэма Бахарева и Памятки для олимпиадников)",
        "source_type": "text",
        "excerpt": "Функция; графическое представление; наклон; работа функции на заданном диапазоне. Линейная функция: y = kx + b. Полиномиальная/степенная функция; парабола; гипербола; «галочка»; min/max. Парабола: y = ax² + bx + c. Вершина параболы: x* = -b/(2a). Гипербола: y = a/x^n. «Галочка»: y = ax + b/x."
      }
    },
    {
      "id": "mathematical-base.functions-and-graphs.linear-function",
      "title": "Линейная функция",
      "type": "formula",
      "formula": "y = kx + b",
      "definitions": {},
      "explanation": "Линейная функция в контексте записана указанной формулой.",
      "source": {
        "id": "context.functions-and-graphs",
        "name": "Исследовательский контекст, присланный пользователем (на основе Учебника Рэма Бахарева и Памятки для олимпиадников)",
        "source_type": "text",
        "excerpt": "Функция; графическое представление; наклон; работа функции на заданном диапазоне. Линейная функция: y = kx + b. Полиномиальная/степенная функция; парабола; гипербола; «галочка»; min/max. Парабола: y = ax² + bx + c. Вершина параболы: x* = -b/(2a). Гипербола: y = a/x^n. «Галочка»: y = ax + b/x."
      }
    },
    {
      "id": "mathematical-base.functions-and-graphs.polynomial-and-power-functions",
      "title": "Полиномиальная и степенная функции",
      "type": "term",
      "definitions": {},
      "explanation": "Полиномиальная и степенная функции перечислены в контексте вместе.",
      "source": {
        "id": "context.functions-and-graphs",
        "name": "Исследовательский контекст, присланный пользователем (на основе Учебника Рэма Бахарева и Памятки для олимпиадников)",
        "source_type": "text",
        "excerpt": "Функция; графическое представление; наклон; работа функции на заданном диапазоне. Линейная функция: y = kx + b. Полиномиальная/степенная функция; парабола; гипербола; «галочка»; min/max. Парабола: y = ax² + bx + c. Вершина параболы: x* = -b/(2a). Гипербола: y = a/x^n. «Галочка»: y = ax + b/x."
      }
    },
    {
      "id": "mathematical-base.functions-and-graphs.parabola-and-vertex",
      "title": "Парабола и её вершина",
      "type": "formula",
      "formula": "y = ax² + bx + c; x* = -b/(2a)",
      "definitions": {},
      "explanation": "В контексте приведены запись параболы и запись координаты её вершины.",
      "source": {
        "id": "context.functions-and-graphs",
        "name": "Исследовательский контекст, присланный пользователем (на основе Учебника Рэма Бахарева и Памятки для олимпиадников)",
        "source_type": "text",
        "excerpt": "Функция; графическое представление; наклон; работа функции на заданном диапазоне. Линейная функция: y = kx + b. Полиномиальная/степенная функция; парабола; гипербола; «галочка»; min/max. Парабола: y = ax² + bx + c. Вершина параболы: x* = -b/(2a). Гипербола: y = a/x^n. «Галочка»: y = ax + b/x."
      }
    },
    {
      "id": "mathematical-base.functions-and-graphs.hyperbola",
      "title": "Гипербола",
      "type": "formula",
      "formula": "y = a/x^n",
      "definitions": {},
      "explanation": "Гипербола в контексте записана указанной формулой.",
      "source": {
        "id": "context.functions-and-graphs",
        "name": "Исследовательский контекст, присланный пользователем (на основе Учебника Рэма Бахарева и Памятки для олимпиадников)",
        "source_type": "text",
        "excerpt": "Функция; графическое представление; наклон; работа функции на заданном диапазоне. Линейная функция: y = kx + b. Полиномиальная/степенная функция; парабола; гипербола; «галочка»; min/max. Парабола: y = ax² + bx + c. Вершина параболы: x* = -b/(2a). Гипербола: y = a/x^n. «Галочка»: y = ax + b/x."
      }
    },
    {
      "id": "mathematical-base.functions-and-graphs.checkmark-function",
      "title": "Функция «галочка»",
      "type": "formula",
      "formula": "y = ax + b/x",
      "definitions": {},
      "explanation": "Функция «галочка» сохранена в записи, приведённой в контексте.",
      "source": {
        "id": "context.functions-and-graphs",
        "name": "Исследовательский контекст, присланный пользователем (на основе Учебника Рэма Бахарева и Памятки для олимпиадников)",
        "source_type": "text",
        "excerpt": "Функция; графическое представление; наклон; работа функции на заданном диапазоне. Линейная функция: y = kx + b. Полиномиальная/степенная функция; парабола; гипербола; «галочка»; min/max. Парабола: y = ax² + bx + c. Вершина параболы: x* = -b/(2a). Гипербола: y = a/x^n. «Галочка»: y = ax + b/x."
      }
    },
    {
      "id": "mathematical-base.functions-and-graphs.min-max-and-slope",
      "title": "Min/max и наклон",
      "type": "graphical_concept",
      "definitions": {},
      "explanation": "В контексте min/max и наклон перечислены среди конструкций для функций и графиков.",
      "source": {
        "id": "context.functions-and-graphs",
        "name": "Исследовательский контекст, присланный пользователем (на основе Учебника Рэма Бахарева и Памятки для олимпиадников)",
        "source_type": "text",
        "excerpt": "Функция; графическое представление; наклон; работа функции на заданном диапазоне. Линейная функция: y = kx + b. Полиномиальная/степенная функция; парабола; гипербола; «галочка»; min/max. Парабола: y = ax² + bx + c. Вершина параболы: x* = -b/(2a). Гипербола: y = a/x^n. «Галочка»: y = ax + b/x."
      }
    }
  ]
}
