{
  "schema_version": 1,
  "section": "monopoly",
  "section_title": "Монополия",
  "topic": "17-practice-25-33",
  "topic_title": "Практикум: задачи 25–33",
  "knowledge": [
    {
      "id": "monopoly.practice.discrimination-and-advanced",
      "title": "Дискриминация и продвинутые модели 25–33",
      "type": "example",
      "explanation": "Блок включает дискриминацию между рынками и расхождения ключа (25–26), первый род с фиксированными затратами (27), многотоварные задачи с общими ограничениями (28, 30), внешний рынок (29), параметрическое сравнение прибыли (31), межвременные цены (32) и меню для скрытых типов работников (33).",
      "source": {"id": "monopoly-analysis-docx", "name": "Полный аналитический конспект по монополии (DOCX)", "source_type": "docx", "excerpt": "Задачи 25–33 включают ценовую дискриминацию и продвинутые модели."}
    }
  ]
}
