{"schema_version":1,"section":"costs-and-firm","section_title":"Издержки и фирма","topic":"cost-concepts","topic_title":"Понятия издержек","knowledge":[
{"id":"costs-and-firm.cost-concepts.explicit-and-accounting-costs","title":"Явные и бухгалтерские издержки","type":"term","definitions":{},"explanation":"Явные и бухгалтерские издержки перечислены в исследовательском отчёте.","source":{"id":"context.costs-and-firm.cost-concepts","name":"Исследовательский контекст, присланный пользователем","source_type":"text","excerpt":"Издержки: явные; бухгалтерские; неявные; издержки упущенных возможностей; экономические издержки; FC; VC; TC; AC; AFC; AVC; MC; дискретный MC; связи между средними и предельными издержками."}},
{"id":"costs-and-firm.cost-concepts.implicit-and-opportunity-costs","title":"Неявные и альтернативные издержки","type":"term","definitions":{},"explanation":"Неявные издержки и издержки упущенных возможностей перечислены в отчёте.","source":{"id":"context.costs-and-firm.cost-concepts","name":"Исследовательский контекст, присланный пользователем","source_type":"text","excerpt":"Издержки: явные; бухгалтерские; неявные; издержки упущенных возможностей; экономические издержки; FC; VC; TC; AC; AFC; AVC; MC; дискретный MC; связи между средними и предельными издержками."}},
{"id":"costs-and-firm.cost-concepts.economic-costs","title":"Экономические издержки","type":"term","definitions":{},"explanation":"Экономические издержки названы отдельным элементом отчёта.","source":{"id":"context.costs-and-firm.cost-concepts","name":"Исследовательский контекст, присланный пользователем","source_type":"text","excerpt":"Издержки: явные; бухгалтерские; неявные; издержки упущенных возможностей; экономические издержки; FC; VC; TC; AC; AFC; AVC; MC; дискретный MC; связи между средними и предельными издержками."}},
{"id":"costs-and-firm.cost-concepts.fixed-variable-total-costs","title":"FC, VC и TC","type":"term","definitions":{},"explanation":"FC, VC и TC перечислены в отчёте как виды издержек.","source":{"id":"context.costs-and-firm.cost-concepts","name":"Исследовательский контекст, присланный пользователем","source_type":"text","excerpt":"Издержки: явные; бухгалтерские; неявные; издержки упущенных возможностей; экономические издержки; FC; VC; TC; AC; AFC; AVC; MC; дискретный MC; связи между средними и предельными издержками."}},
{"id":"costs-and-firm.cost-concepts.average-costs","title":"AC, AFC и AVC","type":"term","definitions":{},"explanation":"AC, AFC и AVC перечислены в отчёте как средние издержки.","source":{"id":"context.costs-and-firm.cost-concepts","name":"Исследовательский контекст, присланный пользователем","source_type":"text","excerpt":"Издержки: явные; бухгалтерские; неявные; издержки упущенных возможностей; экономические издержки; FC; VC; TC; AC; AFC; AVC; MC; дискретный MC; связи между средними и предельными издержками."}},
{"id":"costs-and-firm.cost-concepts.marginal-and-discrete-cost","title":"MC, дискретный MC и связи издержек","type":"causal_relationship","definitions":{},"explanation":"Отчёт включает MC, дискретный MC и связи между средними и предельными издержками.","source":{"id":"context.costs-and-firm.cost-concepts","name":"Исследовательский контекст, присланный пользователем","source_type":"text","excerpt":"Издержки: явные; бухгалтерские; неявные; издержки упущенных возможностей; экономические издержки; FC; VC; TC; AC; AFC; AVC; MC; дискретный MC; связи между средними и предельными издержками."}}]}
