{
  "schema_version": 1,
  "section": "monopoly",
  "section_title": "Монополия",
  "topic": "13-intertemporal",
  "topic_title": "Последовательное ценообразование",
  "knowledge": [
    {
      "id": "monopoly.intertemporal.residual-demand",
      "title": "Остаточный спрос и совместный выбор цен",
      "type": "mechanism",
      "explanation": "Ранние продажи меняют количество покупателей, остающихся для следующих периодов. Нужно построить остаточный спрос и максимизировать общую прибыль по всем периодам с учётом возможных ограничений снижения цены.",
      "source": {"id": "monopoly-analysis-docx", "name": "Полный аналитический конспект по монополии (DOCX)", "source_type": "docx", "excerpt": "Продажи раннего периода изменяют остаточный спрос позднего периода."}
    }
  ]
}
