{"schema_version":1,"section":"costs-and-firm","section_title":"Издержки и фирма","topic":"profit-maximization","topic_title":"Максимизация прибыли","knowledge":[
{"id":"costs-and-firm.profit-maximization.profit-objective","title":"Целевая функция прибыли","type":"formula","formula":"Π(Q)=TR-TC","definitions":{},"explanation":"Отчёт задаёт Π(Q)=TR-TC и непосредственную максимизацию прибыли.","source":{"id":"context.costs-and-firm.profit-maximization","name":"Исследовательский контекст, присланный пользователем","source_type":"text","excerpt":"Максимизация прибыли: Π(Q)=TR-TC; непосредственная максимизация; MR=MC; P=MC для конкурентной фирмы; ограничения; проверка характера экстремума; дискретный случай; кусочная TC."}},
{"id":"costs-and-firm.profit-maximization.marginal-rules","title":"MR=MC и P=MC для конкурентной фирмы","type":"formula","formula":"MR=MC; P=MC для конкурентной фирмы","definitions":{},"explanation":"В отчёте названы MR=MC и P=MC для конкурентной фирмы.","source":{"id":"context.costs-and-firm.profit-maximization","name":"Исследовательский контекст, присланный пользователем","source_type":"text","excerpt":"Максимизация прибыли: Π(Q)=TR-TC; непосредственная максимизация; MR=MC; P=MC для конкурентной фирмы; ограничения; проверка характера экстремума; дискретный случай; кусочная TC."}},
{"id":"costs-and-firm.profit-maximization.constraints-discrete-and-piecewise","title":"Ограничения, экстремум, дискретность и кусочная TC","type":"mechanism","definitions":{},"explanation":"Отчёт требует учитывать ограничения, характер экстремума, дискретный случай и кусочную TC.","source":{"id":"context.costs-and-firm.profit-maximization","name":"Исследовательский контекст, присланный пользователем","source_type":"text","excerpt":"Максимизация прибыли: Π(Q)=TR-TC; непосредственная максимизация; MR=MC; P=MC для конкурентной фирмы; ограничения; проверка характера экстремума; дискретный случай; кусочная TC."}}]}
